{
  "schemaVersion": 1,
  "source": "downloads-japanese-pdf-topic-inventory",
  "status": "draft",
  "items": [
    {
      "pdfRef": "001",
      "titleKo": "히라가나",
      "topicCandidates": ["히라가나", "오십음도", "문자와 발음"],
      "inferredLevels": ["ABSOLUTE_ZERO"],
      "levelConfidence": "high",
      "coverageAction": "create_topic",
      "notesKo": "Kana/Absolute Zero 트랙으로 분리한다."
    },
    {
      "pdfRef": "006",
      "titleKo": "인칭대명사",
      "topicCandidates": ["인칭대명사", "1인칭/2인칭/3인칭"],
      "inferredLevels": ["N5", "CONVERSATION"],
      "levelConfidence": "high",
      "coverageAction": "create_topic",
      "notesKo": "어휘와 회화 사용 맥락을 함께 다룬다."
    },
    {
      "pdfRef": "007",
      "titleKo": "지시대명사",
      "topicCandidates": ["これ・それ・あれ", "ここ・そこ・あそこ", "この・その・あの"],
      "inferredLevels": ["N5"],
      "levelConfidence": "high",
      "coverageAction": "split_topic",
      "notesKo": "사물, 장소, 방향, 연체사 계열로 분리한다."
    },
    {
      "pdfRef": "008",
      "titleKo": "です",
      "topicCandidates": ["〜です", "명사/형용사 정중 서술"],
      "inferredLevels": ["N5"],
      "levelConfidence": "high",
      "coverageAction": "map_existing",
      "notesKo": "기존 N5 grammar order 1과 매핑한다."
    },
    {
      "pdfRef": "009",
      "titleKo": "ではない",
      "topicCandidates": ["〜ではない", "〜じゃない", "명사/な형용사 부정"],
      "inferredLevels": ["N5"],
      "levelConfidence": "high",
      "coverageAction": "create_topic",
      "notesKo": "현재 N5 데이터의 동사 부정과 별도 topic으로 관리한다."
    },
    {
      "pdfRef": "010",
      "titleKo": "조사 총정리",
      "topicCandidates": ["は", "が", "を", "に", "で", "へ", "と"],
      "inferredLevels": ["N5"],
      "levelConfidence": "high",
      "coverageAction": "split_topic",
      "notesKo": "조사는 개별 topic으로 분해해 prerequisite를 둔다."
    },
    {
      "pdfRef": "011",
      "titleKo": "인사말",
      "topicCandidates": ["기본 인사", "첫 만남 표현", "정중 인사"],
      "inferredLevels": ["N5", "CONVERSATION"],
      "levelConfidence": "high",
      "coverageAction": "create_topic",
      "notesKo": "회화 can-do와 연결한다."
    },
    {
      "pdfRef": "012",
      "titleKo": "숫자・조수사",
      "topicCandidates": ["숫자", "조수사", "수량 표현"],
      "inferredLevels": ["N5"],
      "levelConfidence": "high",
      "coverageAction": "split_topic",
      "notesKo": "숫자와 조수사는 난이도와 범위가 달라 분리한다."
    },
    {
      "pdfRef": "013",
      "titleKo": "시간・요일",
      "topicCandidates": ["시간 표현", "요일", "날짜/시각"],
      "inferredLevels": ["N5"],
      "levelConfidence": "high",
      "coverageAction": "create_topic",
      "notesKo": "숫자 topic과 prerequisite 관계를 둔다."
    },
    {
      "pdfRef": "014",
      "titleKo": "おねがいします",
      "topicCandidates": ["お願いします", "부탁 표현", "정중 요청"],
      "inferredLevels": ["N5", "CONVERSATION"],
      "levelConfidence": "high",
      "coverageAction": "create_topic",
      "notesKo": "てください와 비교되는 회화 표현으로 관리한다."
    },
    {
      "pdfRef": "015",
      "titleKo": "よ",
      "topicCandidates": ["종조사 よ", "정보 전달 뉘앙스"],
      "inferredLevels": ["N5", "CONVERSATION"],
      "levelConfidence": "high",
      "coverageAction": "map_existing",
      "notesKo": "기존 よ/ね topic에서 분리 검토한다."
    },
    {
      "pdfRef": "016",
      "titleKo": "ね",
      "topicCandidates": ["종조사 ね", "공감/확인 뉘앙스"],
      "inferredLevels": ["N5", "CONVERSATION"],
      "levelConfidence": "high",
      "coverageAction": "map_existing",
      "notesKo": "기존 よ/ね topic에서 분리 검토한다."
    },
    {
      "pdfRef": "017",
      "titleKo": "한자 읽는 법",
      "topicCandidates": ["한자 읽기", "음독/훈독", "후리가나 정책"],
      "inferredLevels": ["ABSOLUTE_ZERO", "N5"],
      "levelConfidence": "medium",
      "coverageAction": "create_topic",
      "notesKo": "N1 확장을 위해 kanji scaffold 축으로 분리한다."
    },
    {
      "pdfRef": "018",
      "titleKo": "い형용사",
      "topicCandidates": ["い形容詞", "い형용사 활용"],
      "inferredLevels": ["N5"],
      "levelConfidence": "high",
      "coverageAction": "map_existing",
      "notesKo": "기존 형용사 topic과 매핑한다."
    },
    {
      "pdfRef": "019",
      "titleKo": "い형용사의 명사화",
      "topicCandidates": ["い형용사 명사화", "〜さ", "〜み"],
      "inferredLevels": ["N4", "N3"],
      "levelConfidence": "medium",
      "coverageAction": "create_topic",
      "notesKo": "N5 형용사 기본과 구분한다."
    },
    {
      "pdfRef": "020",
      "titleKo": "な",
      "topicCandidates": ["な형용사 명사 수식", "な"],
      "inferredLevels": ["N5"],
      "levelConfidence": "medium",
      "coverageAction": "map_existing",
      "notesKo": "다음 PDF의 な형용사 topic과 합칠지 검토한다."
    },
    {
      "pdfRef": "021",
      "titleKo": "な형용사",
      "topicCandidates": ["な形容詞", "な형용사 활용"],
      "inferredLevels": ["N5"],
      "levelConfidence": "high",
      "coverageAction": "map_existing",
      "notesKo": "기존 형용사 topic과 매핑한다."
    },
    {
      "pdfRef": "022",
      "titleKo": "けど",
      "topicCandidates": ["〜けど", "역접/완곡 연결"],
      "inferredLevels": ["N5"],
      "levelConfidence": "high",
      "coverageAction": "map_existing",
      "notesKo": "기존 けど/が topic과 매핑한다."
    },
    {
      "pdfRef": "023",
      "titleKo": "동사의 종류와 특징",
      "topicCandidates": ["る動詞", "う動詞", "불규칙 동사", "동사 그룹"],
      "inferredLevels": ["N5"],
      "levelConfidence": "high",
      "coverageAction": "split_topic",
      "notesKo": "동사 활용 prerequisite의 핵심 topic이다."
    },
    {
      "pdfRef": "024",
      "titleKo": "동사의 정중형",
      "topicCandidates": ["〜ます", "정중형", "ます형"],
      "inferredLevels": ["N5"],
      "levelConfidence": "high",
      "coverageAction": "map_existing",
      "notesKo": "기존 ます/ません/ました 계열과 매핑한다."
    },
    {
      "pdfRef": "025",
      "titleKo": "ある・いる",
      "topicCandidates": ["ある", "いる", "존재 동사"],
      "inferredLevels": ["N5"],
      "levelConfidence": "high",
      "coverageAction": "create_topic",
      "notesKo": "현재 grammar JSON에는 명시 항목이 없어 topic으로 추가한다."
    },
    {
      "pdfRef": "026",
      "titleKo": "정중형의 응용표현",
      "topicCandidates": ["ます형 응용", "제안/목적/연결"],
      "inferredLevels": ["N5"],
      "levelConfidence": "medium",
      "coverageAction": "split_topic",
      "notesKo": "ましょう, に行きます 등으로 분해한다."
    },
    {
      "pdfRef": "027",
      "titleKo": "で",
      "topicCandidates": ["조사 で", "행동 장소", "수단"],
      "inferredLevels": ["N5"],
      "levelConfidence": "high",
      "coverageAction": "map_existing",
      "notesKo": "기존 N5 で topic과 매핑한다."
    },
    {
      "pdfRef": "028",
      "titleKo": "ながら",
      "topicCandidates": ["〜ながら", "동시 동작"],
      "inferredLevels": ["N5", "N4"],
      "levelConfidence": "high",
      "coverageAction": "map_existing",
      "notesKo": "N4 역접 용법과 분리 가능하다."
    },
    {
      "pdfRef": "029",
      "titleKo": "すぎる",
      "topicCandidates": ["〜すぎる", "과도 표현"],
      "inferredLevels": ["N5", "N4"],
      "levelConfidence": "high",
      "coverageAction": "map_existing",
      "notesKo": "N5/N4 중복 항목으로 내부 난이도 기준을 별도 저장한다."
    },
    {
      "pdfRef": "030",
      "titleKo": "やすい",
      "topicCandidates": ["〜やすい", "〜にくい", "용이/곤란"],
      "inferredLevels": ["N5", "N4"],
      "levelConfidence": "high",
      "coverageAction": "map_existing",
      "notesKo": "기존 やすい/にくい 항목과 연결한다."
    },
    {
      "pdfRef": "031",
      "titleKo": "なさい",
      "topicCandidates": ["〜なさい", "명령/지시"],
      "inferredLevels": ["N4", "CONVERSATION"],
      "levelConfidence": "medium",
      "coverageAction": "create_topic",
      "notesKo": "명령형/관계 맥락과 함께 다룬다."
    },
    {
      "pdfRef": "032",
      "titleKo": "たい",
      "topicCandidates": ["〜たい", "희망 표현"],
      "inferredLevels": ["N5"],
      "levelConfidence": "high",
      "coverageAction": "map_existing",
      "notesKo": "기존 N5 희망 표현과 매핑한다."
    },
    {
      "pdfRef": "033",
      "titleKo": "にいく",
      "topicCandidates": ["〜に行く", "목적 이동"],
      "inferredLevels": ["N5"],
      "levelConfidence": "high",
      "coverageAction": "map_existing",
      "notesKo": "기존 N5 に行きます 항목과 매핑한다."
    },
    {
      "pdfRef": "034",
      "titleKo": "し",
      "topicCandidates": ["〜し", "이유/나열"],
      "inferredLevels": ["N4", "N3"],
      "levelConfidence": "high",
      "coverageAction": "map_existing",
      "notesKo": "N4/N3 모두 존재하는 경계 항목이다."
    },
    {
      "pdfRef": "035",
      "titleKo": "の",
      "topicCandidates": ["〜の", "소유", "명사화", "설명"],
      "inferredLevels": ["N5", "N4"],
      "levelConfidence": "medium",
      "coverageAction": "split_topic",
      "notesKo": "소유/명사화/설명 용법을 분리한다."
    },
    {
      "pdfRef": "036",
      "titleKo": "동사의 연결형",
      "topicCandidates": ["て형 연결", "동사 연결", "연용형"],
      "inferredLevels": ["N5"],
      "levelConfidence": "medium",
      "coverageAction": "split_topic",
      "notesKo": "て형과 ます형 어간 연결을 구분해 검토한다."
    },
    {
      "pdfRef": "037",
      "titleKo": "てください",
      "topicCandidates": ["〜てください", "정중 요청"],
      "inferredLevels": ["N5"],
      "levelConfidence": "high",
      "coverageAction": "map_existing",
      "notesKo": "기존 N5 요청 표현과 매핑한다."
    },
    {
      "pdfRef": "038",
      "titleKo": "てみる",
      "topicCandidates": ["〜てみる", "시도"],
      "inferredLevels": ["N4"],
      "levelConfidence": "high",
      "coverageAction": "map_existing",
      "notesKo": "기존 N4 grammar order 4와 매핑한다."
    },
    {
      "pdfRef": "039",
      "titleKo": "ておく",
      "topicCandidates": ["〜ておく", "사전 준비"],
      "inferredLevels": ["N4"],
      "levelConfidence": "high",
      "coverageAction": "map_existing",
      "notesKo": "기존 N4 grammar order 3과 매핑한다."
    },
    {
      "pdfRef": "040",
      "titleKo": "てしまう",
      "topicCandidates": ["〜てしまう", "완료/유감"],
      "inferredLevels": ["N4"],
      "levelConfidence": "high",
      "coverageAction": "map_existing",
      "notesKo": "기존 N4 grammar order 1과 매핑한다."
    },
    {
      "pdfRef": "041",
      "titleKo": "てもいい",
      "topicCandidates": ["〜てもいい", "허가"],
      "inferredLevels": ["N5", "N4"],
      "levelConfidence": "high",
      "coverageAction": "map_existing",
      "notesKo": "N5 정중 질문형과 N4 평서형을 구분한다."
    },
    {
      "pdfRef": "042",
      "titleKo": "てはいけない",